{
  "name":"Vitap K2",
  "model":"K2",
  "vendor":"Vitap",
  "units":"mm",
  "supported_ops":["DRILL","SLOT","SAW"],
  "z_sign":"down_negative",
  "faces_supported":[1,2,3,4,5,6,7],
  "limits":{
    "drill_dia_mm":{"min":3,"max":35},
    "slot_width_mm":{"min":4,"max":12},
    "z_mm":{"min":0,"max":40}
  },
  "tools":[
    {"id":"T1","name":"Ã˜5 drill","dia_mm":5,"rpm":4000,"feed_mm_min":600}
  ],
  "tcn":{"version":"01.00","header_comment":"demo"}
}
